{
  "schemaVersion": 1,
  "observationId": "observation_aaaaaaaaaaaaaaaaaaaaaaaaaaaaaaaaaaaaaaaaaaaaaaaaaaaaaaaaaaaaaaaa",
  "runId": "run-p1b",
  "requestId": "prepare-implementer",
  "requestDigest": "bbbbbbbbbbbbbbbbbbbbbbbbbbbbbbbbbbbbbbbbbbbbbbbbbbbbbbbbbbbbbbbb",
  "rootSessionId": "session-root",
  "role": "implementer",
  "spawnToolUseIds": [],
  "subagentStartEventIds": [],
  "bindingIds": [],
  "observationDigest": "cccccccccccccccccccccccccccccccccccccccccccccccccccccccccccccccc",
  "createdAt": "2026-07-26T00:00:00.000Z"
}
